trend_id,trend_name,n_keywords,n_videos,total_composite_score,avg_composite_score,max_composite_score,avg_keyword_score,trend_strength,top_keywords,all_keywords,rank
116,makeuptransformation + makeup transformation + unbelievable makeup transformation,11,11,1.9888310075372044,0.18080281886701857,0.3701434283388992,0.9694043596904053,1.490575042492187,"makeuptransformation, makeup transformation, unbelievable makeup transformation, stunning makeup transformation, transform your makeup","makeup transformation, makeuptransformation, unbelievable makeup transformation, stunning makeup transformation, transform your makeup",46
133,hair colour transformation + hair color transformation + hair color transformations,11,11,1.774291642930124,0.1612992402663749,0.3579444154226699,0.9910993723619218,1.4890629714462973,"hair colour transformation, hair color transformation, hair color transformations, colour hair transformation, hair dye transformation","hair color transformation, hair color transformations, colour hair transformation, hair colour transformation, hair dye transformation, red hair transformations",47
96,reveal + secret + secrets,11,11,2.293561597161727,0.2085055997419752,0.3931700458078127,0.8516533906670102,1.4753356829499948,"reveal, secret, secrets, secrets revealed, secrets part","secret, secrets, secrets revealed, reveal, secrets part, wait to reveal, secret my morning",48
21,serum + changing serum formula + game changing serum,14,10,2.304908099972759,0.16463629285519707,0.2256613439430009,0.9445915964696742,1.4682723363800632,"serum, changing serum formula, game changing serum, good serum buy, good serum","serum, changing serum formula, game changing serum, good serum buy, good serum, serum buy, growth serum, correcting serum advanced, serum achieve naturally",49
15,routine + daily routine professional + daily routines,12,10,2.2705699768755734,0.18921416473963112,0.3040844477593318,0.9236151890986687,1.457140332107125,"routine, daily routine professional, daily routines, routine timed, routine worth","daily routine professional, routine, daily routines, routine timed, routine worth, routine for working, wach day routine, day routine",50
129,hair growth + hairgrowth + anti hair loss,13,9,3.3845590869403424,0.26035069899541097,0.421281891684902,0.9645489460666175,1.4559547690710912,"hair growth, hairgrowth, anti hair loss, hair loss scalp, hair growth tips","anti hair loss, hair loss scalp, hair growth tips, hair growth, hairgrowth, increase your hair, hair growth journey, bald hair growth, hair growth routine, hair problems",51
41,body lotion + bliss body lotion + whitening body lotion,20,9,2.36117405028032,0.118058702514016,0.2148216769612692,0.9661493342584272,1.454133758575851,"body lotion, bliss body lotion, whitening body lotion, moisturizer put moisturizer, fruit body lotion","bliss body lotion, whitening body lotion, body lotion, moisturizer put moisturizer, fruit body lotion, moisturizer, body lotion madame, lotion madame, importance of moisturizers, moisturizers, lotion, lotion yang terbukti, body lotion yang, memutihkan body lotion, lotion yang, body treat lotion",52
80,face yoga + face tightening yoga + facial yoga anti,15,8,3.1778969270617727,0.2118597951374515,0.3822435919587796,0.9877571939414339,1.4172580804879884,"face yoga, face tightening yoga, facial yoga anti, face yoga exercises, fitness facial yoga","face yoga exercises, face yoga, fitness facial yoga, yoga face fitness, face tightening yoga, facial yoga anti, face yoga vibhuti, challange face yoga, lifting facial yoga",53
29,vlog + minivlog + vlogs long lasting,9,9,1.7069144970282182,0.18965716633646867,0.4810332178226654,0.9627626000425702,1.4007422164064778,"vlog, minivlog, vlogs long lasting, sandhu vlogs, vlog supporting","vlog, minivlog, vlogs long lasting, sandhu vlogs, vlog supporting, vlog finishing",54
20,natural + natural vs defined + naturallooking,12,9,2.0266261051246315,0.16888550876038597,0.2392210462114843,0.8409589029952701,1.396386406170942,"natural, natural vs defined, naturallooking, quick natural, check natural","natural vs defined, natural, naturallooking, quick natural, check natural",55
107,huda beauty + hudabeauty huda beauty + huda beauty mate,13,8,2.0907914014804803,0.16083010780619078,0.4459839921139052,0.9912998808440692,1.3893045724066848,"huda beauty, hudabeauty huda beauty, huda beauty mate, beautyhack, weekly beauty routines","huda beauty mate, hudabeauty huda beauty, huda beauty, beautyhack, weekly beauty routines, weekly beauty, batman huda beauty, huda beauty insta, beauty show hunny, beauty huda beauty",56
73,bridal + bridal reception makeover + pre bridal packages,13,8,2.2585100255039565,0.17373154042338126,0.3114094855424094,0.9565343036465974,1.3862218867523477,"bridal, bridal reception makeover, pre bridal packages, pre bridal pre, pre bridal services","bridal, bridal reception makeover, pre bridal packages, pre bridal pre, pre bridal services, pre bridal, bridal services, book your bridal, bridal and pre, lasting bridal",57
113,beauty products + int products beauty + beauty products dior,11,8,1.844784562870177,0.16770768753365245,0.2661814131640666,0.9783974737919913,1.373372296931782,"beauty products, int products beauty, beauty products dior, products dior beauty, beauty products cute","beauty products, int products beauty, beauty products dior, products dior beauty, beauty products cute, beautyproducts",58
89,tutorial + full video tutorial + video tutorial,11,8,1.853719026984094,0.16851991154400855,0.267929502029308,0.9755974501420872,1.373055959404908,"tutorial, full video tutorial, video tutorial, full youtube tutorial, tutorial in description","tutorial, full video tutorial, video tutorial, full youtube tutorial, tutorial in description, tutorial full details, full tutorial full, tutorial easy everyday, tutorial covers essential",59
97,lasting indian bridal + indian wedding guest + indian bridal makeup,19,7,2.6716612467579512,0.14061374982936586,0.3094950215142502,0.9853018877010086,1.3705943465163448,"lasting indian bridal, indian wedding guest, indian bridal makeup, indianwedding credits bride, indian bridal reception","indian wedding guest, indianwedding credits bride, lasting indian bridal, indian bridal reception, easy indian wedding, indian wedding, indian bridal makeup, bengali bridal makeup, bridal makeup bengali, makeup bengali bridal, bengali bridal saree, bridal saree bengali, saree bengali bridal, ideas bengali bridal, indian bridal",60
67,finishing touches + touches + hand,13,8,1.7491797345797215,0.1345522872753632,0.2368215895882262,0.9194532169291243,1.3670518934644478,"finishing touches, touches, hand, finishing touch, touch","finishing touches, hand, finishing touch, touch, touches are essential, touches, touch management, finishing touches perfect",61
25,arabic + Ù„ÙˆÙ† Ø¹ÙŠÙˆÙ†Ùƒ #Ø§ÙƒØ³Ø¨Ù„ÙˆØ± + Ù‡Ø°Ø§ Ø§Ù„Ù„ÙˆÙƒ Ù„Ù„Ø¬Ù…ÙŠÙ„Ø©,36,5,10.120353190707949,0.2811209219641097,0.4031908678156223,0.964592855527466,1.3550504266503707,"arabic, Ù„ÙˆÙ† Ø¹ÙŠÙˆÙ†Ùƒ #Ø§ÙƒØ³Ø¨Ù„ÙˆØ±, Ù‡Ø°Ø§ Ø§Ù„Ù„ÙˆÙƒ Ù„Ù„Ø¬Ù…ÙŠÙ„Ø©, Ø§Ù„Ù„ÙˆÙƒ Ù„Ù„Ø¬Ù…ÙŠÙ„Ø© Ù…Ø§ÙŠØ§, Ù„Ù„Ø¬Ù…ÙŠÙ„Ø© Ù…Ø§ÙŠØ§ Ø§Ù„ØªÙŠ","arabic, Ù„ÙˆÙ† Ø¹ÙŠÙˆÙ†Ùƒ #Ø§ÙƒØ³Ø¨Ù„ÙˆØ±, Ø¹Ø§Ù„Ù… Ø§Ù„Ø¬Ù…Ø§Ù„ Ù†Ù‚Ø¯Ù…, Ø£Ø­Ø¯Ø« ØªÙ‚Ù†ÙŠØ§Øª Ø§Ù„Ù…ÙƒÙŠØ§Ø¬, ØªÙ‚Ù†ÙŠØ§Øª Ø§Ù„Ù…ÙƒÙŠØ§Ø¬ Ù†ØµØ§Ø¦Ø­, Ø§Ù„Ù…ÙƒÙŠØ§Ø¬ Ù†ØµØ§Ø¦Ø­ Ø§Ù„Ø¹Ù†Ø§ÙŠØ©, Ù†ØµØ§Ø¦Ø­ Ø§Ù„Ø¹Ù†Ø§ÙŠØ© Ø¨Ø§Ù„Ø¨Ø´Ø±Ø©, Ø§Ù„Ø¹Ù†Ø§ÙŠØ© Ø¨Ø§Ù„Ø¨Ø´Ø±Ø© ÙˆØªØ¬Ø§Ø±Ø¨, Ø¨Ø§Ù„Ø¨Ø´Ø±Ø© ÙˆØªØ¬Ø§Ø±Ø¨ Ø£ÙØ¶Ù„, ÙˆØªØ¬Ø§Ø±Ø¨ Ø£ÙØ¶Ù„ Ø§Ù„Ù…Ù†ØªØ¬Ø§Øª, Ø£ÙØ¶Ù„ Ø§Ù„Ù…Ù†ØªØ¬Ø§Øª Ù‡Ø¯ÙÙ†Ø§, ÙØ²Ø§Ø¯ Ø¬Ù…Ø§Ù„Ùƒ, Ø§Ù„Ø¬Ù…Ø§Ù„ Ø¬Ù…Ø§Ù„Ø§, Ø¬Ù…Ø§Ù„Ùƒ Ø¹Ù† Ø§Ù„Ø¬Ù…Ø§Ù„, ÙØ²Ø§Ø¯, Ø¬Ù…Ø§Ù„Ø§, Ø¬Ù…Ø§Ù„Ùƒ, Ø§Ù„Ø¬Ù…Ø§Ù„, Ø§Ø­Ù…Ø± Ø§Ù„Ø´ÙØ§Ù‡ Ù†Ø§Ø²Ùƒ, Ø§Ø¬Ù…Ù„ Ù‡Ø°Ø§ Ø§Ù„Ù„ÙˆÙƒ, Ù‡Ø°Ø§ Ø§Ù„Ù„ÙˆÙƒ Ù„Ù„Ø¬Ù…ÙŠÙ„Ø©, Ø§Ù„Ù„ÙˆÙƒ Ù„Ù„Ø¬Ù…ÙŠÙ„Ø© Ù…Ø§ÙŠØ§, Ù„Ù„Ø¬Ù…ÙŠÙ„Ø© Ù…Ø§ÙŠØ§ Ø§Ù„ØªÙŠ, Ù…Ø§ÙŠØ§ Ø§Ù„ØªÙŠ ØªØ§Ù„Ù‚Øª, Ø§Ù„ØªÙŠ ØªØ§Ù„Ù‚Øª Ø¨Ø§Ù„Ø§ÙŠÙ„Ø§ÙŠÙ†Ø±, Ø§Ù„Ø´ÙØ§Ù‡ Ù†Ø§Ø²Ùƒ, Ø§Ù„ÙƒÙŠØ±Ù„ÙŠ Ø§Ù†Ù‡ Ø·Ø¨ÙŠØ¹ÙŠ, Ø§Ù†Ù‡ Ø·Ø¨ÙŠØ¹ÙŠ ÙˆØ­Ù„Ùˆ, Ø·Ø¨ÙŠØ¹ÙŠ ÙˆØ­Ù„Ùˆ ÙˆÙ…Ø´, ÙˆØ­Ù„Ùˆ ÙˆÙ…Ø´ Ø¨ÙŠØ­ØªØ§Ø¬, Ù…Ø¬Ù‡ÙˆØ¯ ÙˆÙ„Ø§ Ø¹Ù†Ø§ÙŠØ©, ÙˆÙ„Ø§ Ø¹Ù†Ø§ÙŠØ© Ø§Ù„Ø´Ø¹Ø±, Ø£Ø­Ù„ÙŠ Ø­Ø§Ø¬Ø©, Ø­Ø§Ø¬Ø© ÙÙŠ Ø§Ù„ÙƒÙŠØ±Ù„ÙŠ, Ø§Ù„ÙƒÙŠØ±Ù„ÙŠ Ø§Ù†Ù‡, Ø§Ù†Ù‡ Ø·Ø¨ÙŠØ¹ÙŠ",62
90,makeupvideo + popular makeup video + makeup videos,8,8,1.444490948308344,0.180561368538543,0.3082686506770107,0.9762365621714475,1.3480280116639625,"makeupvideo, popular makeup video, makeup videos, makeuptutorial full video, youtube makeup","popular makeup video, makeup videos, makeupvideo, makeuptutorial full video, youtube makeup, makeupvideosforbiggners",63
117,usa + miami + nyc,10,8,1.1845720847022376,0.11845720847022376,0.1720471116612805,0.9230149132394754,1.3388195034032873,"usa, miami, nyc, south africa, south","nyc, south africa, south, africa, usa, miami, germany, worldwide",64
84,wedding + wedding guest + guests feminine women,10,7,2.0007277349258232,0.20007277349258232,0.3928646762625399,0.9510612725491627,1.3218002305093788,"wedding, wedding guest, guests feminine women, wedding guests feminine, stylish wedding guest","wedding, wedding guest, guests feminine women, wedding guests feminine, stylish wedding guest",65
127,hair colour highlights + colour highlights hair + highlights hair colour,12,7,1.1947417291543974,0.09956181076286645,0.1584608071551246,0.9817514632872144,1.3144903883043908,"hair colour highlights, colour highlights hair, highlights hair colour, hair highlight highlight, hair highlight","hair colour highlights, colour highlights hair, highlights hair colour, hair highlight highlight, hair highlight, hair color highlights, hair colour highlightening, purple highlights hair, highlights hair color, highlights hair, hair highlighting",66
60,mature skin + maintain youthful skin + taking mature skin,9,7,1.3509947915886782,0.15011053239874203,0.3390976257943077,0.9815027953473514,1.3033688447604317,"mature skin, maintain youthful skin, taking mature skin, anti aging skincare, aging skincare","maintain youthful skin, taking mature skin, anti aging skincare, aging skincare, winter skin care, mature skin save, mature skin, mature skin anti",67
19,smoothing + smooth + smoothingtreatment,9,7,1.5597307796682134,0.1733034199631348,0.2041708445154529,0.9230770290723095,1.2986415577747414,"smoothing, smooth, smoothingtreatment, achieve a smooth, smooth and natural","smoothing, smoothingtreatment, smooth, achieve a smooth, smooth and natural",68
132,beautiful hair + gorgeous hairstyle + beautiful hair style,9,7,1.1948168840399556,0.13275743155999506,0.2016197215789259,0.9818109277619782,1.298224540991733,"beautiful hair, gorgeous hairstyle, beautiful hair style, amazing hair, gorgeous hair","amazing hair, gorgeous hairstyle, beautiful hair style, beautiful hair, gorgeous hair",69
71,color transformation + colour transformation + colourtransformation,9,7,1.2372406079011204,0.13747117865568004,0.1778993733908832,0.9526283648625969,1.2938021525405623,"color transformation, colour transformation, colourtransformation, color transformation sahil, dye transformation","colourtransformation, color transformation sahil, color transformation, dye transformation, colour transformation, colour transformation black",70
81,anti aging facial + anti aging face + aging facial,15,6,1.948001230594561,0.12986674870630407,0.2981174853999739,0.9878422718767709,1.2921514108333487,"anti aging facial, anti aging face, aging facial, aging facial technique, aging facial yoga","anti aging facial, anti aging face, aging facial technique, aging facial, aging facial yoga, face anti aging, aging face, aging facial exercise",71
63,business inquiry email + channel business inquiries + business inquiries product,9,6,2.196335860503116,0.24403731783367955,0.412489539093656,0.9975257732760058,1.281338918926835,"business inquiry email, channel business inquiries, business inquiries product, business inquiries supereasyofficial, business inquiries emailreneetoday","business inquiry email, channel business inquiries, business inquiries product, business inquiries supereasyofficial, business inquiries emailreneetoday, theyawndawn business inquiries, business inquiries theyawndawn, business email spillbeebusiness, spillbee business email",72
102,beauty salon + royal beauty salon + liza beauty salon,11,6,1.7261042829830573,0.15691857118027794,0.1778418047560728,0.9880624888870373,1.2715427937324162,"beauty salon, royal beauty salon, liza beauty salon, leading beauty salon, joyaz beauty salon","royal beauty salon, beauty salon, liza beauty salon, leading beauty salon, joyaz beauty salon, beauty salon joyaz, salon joyaz beauty, noor beauty salon",73
10,gel + lime gel + favorite gels,11,6,1.575693196769654,0.14324483606996855,0.2021565958267224,0.9462315748553631,1.2590744903929887,"gel, lime gel, favorite gels, gels, styling gel update","gel, lime gel, favorite gels, gels, styling gel update, moisture styling gel, gel update, styling gel, defining crÃ¨me gel, crÃ¨me gel photo",74
120,summer + hot girl summer + girl summer aint,9,6,1.611871622509244,0.17909684694547157,0.31875687305044,0.9678286521367032,1.2559173534325119,"summer, hot girl summer, girl summer aint, girl summer honestly, girl summer","summer, hot girl summer, girl summer aint, girl summer honestly, girl summer",75
23,ğğ®ğ¬ğ¢ğ§ğğ¬ğ¬ ğ¢ğ§ğªğ®ğ¢ğ«ğ¢ğğ¬ nikiivictoria + à¶‘à¶šà¶§ à¶šà¶»à¶´ + ğ—¦ğ—¢ğ—•ğ—¥ğ—˜ ğ—§ğ—¢ğ—§ğ—”ğ—Ÿğ— ğ—˜ğ——ğ—œğ—¢ğ—¦ totalmedios,16,5,2.758086969565049,0.17238043559781557,0.2799299867401723,0.9976464243909706,1.2512685376543824,"ğğ®ğ¬ğ¢ğ§ğğ¬ğ¬ ğ¢ğ§ğªğ®ğ¢ğ«ğ¢ğğ¬ nikiivictoria, à¶‘à¶šà¶§ à¶šà¶»à¶´, ğ—¦ğ—¢ğ—•ğ—¥ğ—˜ ğ—§ğ—¢ğ—§ğ—”ğ—Ÿğ— ğ—˜ğ——ğ—œğ—¢ğ—¦ totalmedios, medios ğ—¦ğ—¢ğ—•ğ—¥ğ—˜ ğ—§ğ—¢ğ—§ğ—”ğ—Ÿğ— ğ—˜ğ——ğ—œğ—¢ğ—¦, totalmedios ğ™‹ğ™–ğ™§ğ™– ğ™«ğ™šğ™§","ğğ®ğ¬ğ¢ğ§ğğ¬ğ¬ ğ¢ğ§ğªğ®ğ¢ğ«ğ¢ğğ¬ nikiivictoria, à¶‘à¶šà¶§ à¶šà¶»à¶´, ğ—¦ğ—¢ğ—•ğ—¥ğ—˜ ğ—§ğ—¢ğ—§ğ—”ğ—Ÿğ— ğ—˜ğ——ğ—œğ—¢ğ—¦ totalmedios, medios ğ—¦ğ—¢ğ—•ğ—¥ğ—˜ ğ—§ğ—¢ğ—§ğ—”ğ—Ÿğ— ğ—˜ğ——ğ—œğ—¢ğ—¦, totalmedios ğ™‹ğ™–ğ™§ğ™– ğ™«ğ™šğ™§, ï½Œï½‰ï½‹ï½… ï½ƒï½ï½ï½ï½…ï½ï½” ï½“ï½ˆï½ï½’ï½…, ï½ƒï½ï½ï½ï½…ï½ï½” ï½“ï½ˆï½ï½’ï½… ï½“ï½•ï½‚ï½“ï½ƒï½’ï½‰ï½‚ï½…, ğ™»ğ™´ğ™³ğ™° ğ™µğ™°ğš‰ğ™°ğ™» ğ—™ğ—®ğ—°ğ—²ğ—¯ğ—¼ğ—¼ğ—¸, ğ‹ğ„ğƒğ€ ğ…ğ€ğ™ğ€ğ‹ ğ—™ğ—¢ğ—¥, ğ—§ğ—œğ—£ğ—¦ ğ™µğ™¾ğ™»ğ™»ğ™¾ğš† ğ™»ğ™´ğ™³ğ™°, ğ™µğ™¾ğ™»ğ™»ğ™¾ğš† ğ™»ğ™´ğ™³ğ™° ğ™µğ™°ğš‰ğ™°ğ™», ğ…ğ€ğ™ğ€ğ‹ ğ—™ğ—¢ğ—¥ ğ— ğ—¢ğ—¥ğ—˜, ğ—™ğ—¢ğ—¥ ğ— ğ—¢ğ—¥ğ—˜ ğ—§ğ—œğ—£ğ—¦, ğ— ğ—¢ğ—¥ğ—˜ ğ—§ğ—œğ—£ğ—¦ ğ™µğ™¾ğ™»ğ™»ğ™¾ğš†, ğ—§ğ—¢ğ—¡ğ—˜ ğ—›ğ—”ğ—œğ—¥ ğ—¦ğ—”ğ—Ÿğ—¢ğ—¡, ğ— ğ—¢ğ—¥ğ—˜ ğ—›ğ—”ğ—œğ—¥ ğ—£ğ—¥ğ—¢ğ——ğ—¨ğ—–ğ—§ğ—¦",76
105,huda beauty lip + fae beauty lip + beauty lip,7,6,1.5344609051623412,0.2192087007374773,0.412489539093656,0.9769917375764805,1.2474691715266482,"huda beauty lip, fae beauty lip, beauty lip, rarebeauty lip, pradabeauty lip","fae beauty lip, beauty lip, rarebeauty lip, huda beauty lip, pradabeauty lip, sacheu beauty lip",77
101,mask makeup + inspired mask makeup + simple mask makeup,7,6,1.4962361475409978,0.21374802107728538,0.267929502029308,0.9757859177256434,1.2455898036584232,"mask makeup, inspired mask makeup, simple mask makeup, face mask makeup, faced makeup","simple mask makeup, face mask makeup, mask makeup, inspired mask makeup, faced makeup",78
3,spray + glitter setting spray + size glitter setting,14,5,2.7849838625321945,0.1989274187522996,0.240219431818614,0.9499859961471359,1.23718423265656,"spray, glitter setting spray, size glitter setting, setting spray, glitter skin","glitter setting spray, size glitter setting, setting spray, glitter skin, size glitter, glitter setting, spray, glitter, flawless setting spray, seal it spray, glittery, glittereyes, spray product",79
118,braids + braided ponytail + men braid styles,15,5,2.219818318493174,0.14798788789954495,0.1948581085802317,0.9787760938506179,1.2341142450551872,"braids, braided ponytail, men braid styles, men braid, braid styles","braids, braided ponytail, men braid styles, men braid, braid styles, hairstyles braid hairstyles, braids hairstyles braid, men braids hairstyles, braided hairstyles braids, braids hairstyles african, women men braids, undercut braided hairstyles, braids styles braid, braidshairstyles",80
70,celebrity + celeb + celebrities,8,6,1.4231312026141403,0.17789140032676753,0.3983493083025631,0.893677161309926,1.2301893697157626,"celebrity, celeb, celebrities, successful celebrity, celebrity learn","celebrity, celeb, celebrities, successful celebrity, celebrity learn",81
22,tan mousse + tan mousse shop + tan mousse danielle,13,5,2.19553546438784,0.16888734341444925,0.2022112649261982,0.9734067099051218,1.2259570656581071,"tan mousse, tan mousse shop, tan mousse danielle, fake tanning tips, tanning tips","tan mousse shop, tan mousse danielle, tan mousse, fake tanning tips, tanning tips, fake tanning, tanning drops nice, fake tan mousse, fake tan, tanologist self tan, dark self tan",82
36,smokey eye + golden eye + eyemask,7,6,0.9747234508315853,0.13924620726165504,0.2275454647540009,0.9674169144850663,1.2215654588656188,"smokey eye, golden eye, eyemask, eyes hollow eyes, doublechin puffy eyes","smokey eye, golden eye, eyemask, eyes hollow eyes, doublechin puffy eyes, eyes smile lines, eyes speak",83
75,facial + facial shape + placement for face,9,5,2.403417819775098,0.26704642441945536,0.3616898783852128,0.9478360397598333,1.2166434322684299,"facial, facial shape, placement for face, shape face shape, youe face shapes","facial, facial shape, placement for face, shape face shape, youe face shapes, face face shapes, face shape face",84
49,outfit breakdown skirt + lace front quot + satin printed dress,8,5,2.046736680153508,0.2558420850191885,0.3742403798385538,0.9698966900717075,1.207158208944942,"outfit breakdown skirt, lace front quot, satin printed dress, printed dress, black lace dress","outfit breakdown skirt, lace front quot, satin printed dress, printed dress, black lace dress, black lace, lace dress, top dresses",85
88,sharma + fiza khan swiss + khan minal khan,11,5,1.7562088491995516,0.15965534992723196,0.4318310133231537,0.9607413080971022,1.205239319267612,"sharma, fiza khan swiss, khan minal khan, aiman khan minal, jÃ i shree krishna","sharma, fiza khan swiss, khan minal khan, aiman khan minal, jÃ i shree krishna, shree krishna, jÃ i shree, krishna, raaz ayeza khan, ayeza khan beauty, ayeza khan",86
85,sajghar antara banerjee + xoxo sandhya raj + sandhya raj,6,5,1.6680137110275006,0.2780022851712501,0.4316743510990746,0.9911453532094409,1.1929245587900166,"sajghar antara banerjee, xoxo sandhya raj, sandhya raj, shraddha kapoor, raja rani","xoxo sandhya raj, sandhya raj, sajghar antara banerjee, shraddha kapoor, raja rani",87
72,keratin + vegan keratin treatment + keratin treatment,11,5,1.3673158179752631,0.12430143799775119,0.1832011987453675,0.9507821212538541,1.1926413083201182,"keratin, vegan keratin treatment, keratin treatment, vegan keratin, highlights kerasmooth keratin","keratin, vegan keratin treatment, keratin treatment, vegan keratin, highlights kerasmooth keratin, kerasmooth highlights kerasmooth, kerasmooth keratin, kerasmooth highlights, highlights kerasmooth, highlights keratin treatment",88
64,facelift + face lifted skin + face lifted,9,5,1.4156577169019284,0.15729530187799204,0.2396822913286286,0.9817738784036614,1.1905056632347564,"facelift, face lifted skin, face lifted, advance face lifting, face lifting firming","face lifted skin, face lifted, advance face lifting, face lifting firming, faceexercise, face lifting, facelift, face lift",89
13,brightening + brightening fade dark + fade dark spots,13,5,1.1848884147983196,0.09114526267679382,0.2015895618238778,0.9123654836161138,1.1904261961790088,"brightening, brightening fade dark, fade dark spots, spots and hyperpigmentation, key to brightening","brightening, brightening fade dark, fade dark spots, spots and hyperpigmentation, key to brightening, brightening fade, fade dark, micropigmentacao, body brightening, brightening tips, fade",90
77,facial massages + massages + massage massage technique,13,4,1.8681004687333331,0.14370003605641024,0.2063022275535618,0.9780648942145912,1.1464038875950076,"facial massages, massages, massage massage technique, massage technique shown, massage techniques including","facial massages, massages, massage massage technique, massage technique shown, massage techniques including, face massage techniques, facial massage anti, talking facial massage, facial massage techniques, facial massage, face massage steps, face massage, massage steps",91
109,lip fillers + lip oil + lip jelly oil,6,5,0.795896902151529,0.1326494836919215,0.2466989997481382,0.9613188270329021,1.1433534131109102,"lip fillers, lip oil, lip jelly oil, lipliner, fav lip products","lip fillers, lip oil, lip jelly oil, lipliner, fav lip products, lip products",92
35,bodymist + bodyoil + bodyserum,6,5,0.8165455138115634,0.1360909189685939,0.1796074958499516,0.9373899277224672,1.1396000638318249,"bodymist, bodyoil, bodyserum, body cupid, bodyscrub","bodyoil, bodyserum, body cupid, bodymist, bodyscrub",93
31,blowout + flexstyle blowout + heatless blowout,11,4,2.242069533342547,0.20382450303114064,0.2503538517758269,0.8842571906672351,1.1302646189952295,"blowout, flexstyle blowout, heatless blowout, blowout reveal, reset my blow","flexstyle blowout, blowout, heatless blowout, blowout reveal, reset my blow, blow from yesterday, blow, blowout routine, perfected my blowout",94
51,kurta set + kurta set haul + summer kurta set,11,4,1.469863461458314,0.1336239510416649,0.3718818097682496,0.9891673279461822,1.1301864808541762,"kurta set, kurta set haul, summer kurta set, kurta set kurtasetshaul, printed kurta set","kurta set, summer kurta set, kurta set kurtasetshaul, printed kurta set, kurta set haul, flipkart kurta set, myntra kurta set, style myntra kurta, myntra kurta",95
125,years of age + season + age,5,5,0.7990341837505359,0.15980683675010718,0.2148216769612692,0.8856662162493778,1.1209550288889352,"years of age, season, age, year, week","years of age, season, age, year, week",96
104,nensi beauty + dior beauty forever + dior beauty diorshow,8,4,1.5066410965900803,0.18833013707376003,0.2661814131640666,0.988912702327462,1.1177792042948824,"nensi beauty, dior beauty forever, dior beauty diorshow, dior beauty dior, beauty dior forever","nensi beauty, dior beauty forever, dior beauty diorshow, dior beauty dior, beauty dior forever, ori beauty, amreenafaiz noor beauty, noor beauty",97
9,lululemon define jacket + lululemon + silk press season,9,4,1.3267855425711996,0.1474206158412444,0.1799859229104181,0.9353244925313327,1.1053247575316845,"lululemon define jacket, lululemon, silk press season, waiting for silk, silk press","lululemon define jacket, lululemon, silk press season, waiting for silk, silk press, silk, silkpress, armanibeauty luminous silk, luminous silk",98
79,charlotte tilbury inspired + charlotte tilbury magic + charlotte tilbury matte,7,4,1.0702453493367874,0.1528921927623982,0.2831491357497503,0.9968039241270862,1.0969477617957606,"charlotte tilbury inspired, charlotte tilbury magic, charlotte tilbury matte, things charlotte tilbury, essentials charlotte tilbury","charlotte tilbury inspired, charlotte tilbury magic, charlotte tilbury matte, things charlotte tilbury, essentials charlotte tilbury, charlotte tilbury review, code charlotte tilbury",99
